{
  "schema_version": 1,
  "ruleset_id": "ruleset.fixture",
  "ruleset_version": "0.1.0",
  "scope": "fixture",
  "description": "只演示两文件摘要；缺少正式规则与开局数据，禁止启动游戏。",
  "datasets": [
    {
      "dataset_id": "map.fixture.world",
      "content_version": "0.1.0",
      "role": "map",
      "relative_path": "Docs/Contracts/Examples/map.fixture.json",
      "schema_contract_id": "urn:coldwarheat:contract:map:1",
      "sha256": "38783f90a57c8a12d7242231be5a7afcc1a04b7cfe89817c05ca1b16f00a7267"
    },
    {
      "dataset_id": "cards.fixture.definitions",
      "content_version": "0.1.0",
      "role": "cards",
      "relative_path": "Docs/Contracts/Examples/cards.fixture.json",
      "schema_contract_id": "urn:coldwarheat:contract:cards:1",
      "sha256": "d088d7d0e9c7b6d45b6ea31d8cd77f4c7223372155288baab9ebdcf127b980ec"
    }
  ],
  "coverage_review": {
    "status": "pending",
    "inventory_reference": "Docs/Contracts/Examples/README.md",
    "review_record": "Fixture only; release coverage not approved"
  },
  "data_digest": "2a4fa55cdc17411743788ca06afa86b807582b95951e3768a8e6aa6f569b30b4"
}
